{
  "$id": "https://posthog-impact.local/schemas/path_map.schema.json",
  "$schema": "https://json-schema.org/draft/2020-12/schema",
  "additionalProperties": false,
  "properties": {
    "component": {
      "arrow_type": "string",
      "type": [
        "string",
        "null"
      ]
    },
    "component_map_version": {
      "arrow_type": "string",
      "type": [
        "string",
        "null"
      ]
    },
    "component_rule_pattern": {
      "arrow_type": "string",
      "type": [
        "string",
        "null"
      ]
    },
    "component_rule_priority": {
      "arrow_type": "int64",
      "type": [
        "integer",
        "null"
      ]
    },
    "component_source": {
      "arrow_type": "string",
      "type": [
        "string",
        "null"
      ]
    },
    "is_unclassified": {
      "arrow_type": "bool",
      "type": [
        "boolean",
        "null"
      ]
    },
    "license_area": {
      "arrow_type": "string",
      "type": [
        "string",
        "null"
      ]
    },
    "nearest_agents_file": {
      "arrow_type": "string",
      "type": [
        "string",
        "null"
      ]
    },
    "owner_count": {
      "arrow_type": "int64",
      "type": [
        "integer",
        "null"
      ]
    },
    "owner_rule_pattern": {
      "arrow_type": "string",
      "type": [
        "string",
        "null"
      ]
    },
    "owner_rule_priority": {
      "arrow_type": "int64",
      "type": [
        "integer",
        "null"
      ]
    },
    "owner_source": {
      "arrow_type": "string",
      "type": [
        "string",
        "null"
      ]
    },
    "owners": {
      "arrow_type": "list<element: string>",
      "type": [
        "array",
        "null"
      ]
    },
    "path": {
      "arrow_type": "string",
      "type": [
        "string",
        "null"
      ]
    },
    "platform": {
      "arrow_type": "string",
      "type": [
        "string",
        "null"
      ]
    },
    "uncertainty": {
      "arrow_type": "list<element: string>",
      "type": [
        "array",
        "null"
      ]
    }
  },
  "title": "path_map",
  "type": "object",
  "x-pipeline-version": "1.0.0",
  "x-schema-version": "1.0.0"
}
